{
  "schema_version": "1.0",
  "principal_id": "prn_01J0000000000001",
  "principal_type": "human",
  "issuer": "https://auth.agentmed.dev",
  "subject": "maintainer-01J0000000000001",
  "audiences": ["agentmed-public-api"],
  "workspace_id": "ws_01J0000000000001",
  "project_ids": ["proj_01J0000000000001"],
  "environment_ids": ["env_01J0000000000001"],
  "scopes": ["signals:write", "cases:read", "artifacts:read", "sources:read", "sources:manage", "capabilities:read"],
  "credential_id": "cred_01J0000000000001",
  "jti_digest": "sha256:2222222222222222222222222222222222222222222222222222222222222222",
  "issued_at": "2026-08-10T08:00:00Z",
  "not_before": "2026-08-10T08:00:00Z",
  "expires_at": "2026-08-10T18:00:00Z",
  "revoked_at": null,
  "revocation_checked_at": "2026-08-10T09:00:00Z",
  "requested_context": {
    "workspace_id": "ws_01J0000000000001",
    "project_id": "proj_01J0000000000001",
    "environment_id": "env_01J0000000000001",
    "required_scope": "signals:write"
  },
  "evaluated_at": "2026-08-10T09:00:00Z",
  "claims_digest": "sha256:1111111111111111111111111111111111111111111111111111111111111111"
}
